transcript_Id,Interviewer,Child,Sentiment (window size 5 / no threshold)
NA0079-PC,OKAY THAT’S FINE THANK YOU AND WHEREABOUTS DID WHERE WERE YOU IN THE HOUSE WHEN DADDY’S STICK HURT YOU,In my bed,"(['fear', 'enjoyment', 'sadness', 'anger'], tensor([0.0612, 0.0985, 0.0872, 0.1184], grad_fn=<DivBackward0>))"
NA0079-PC,IN YOUR BED OKAY AND WAS ANYBODY ELSE THERE,No,"(['fear', 'enjoyment', 'sadness', 'anger'], tensor([0.0239, 0.0705, 0.0632, 0.0832], grad_fn=<DivBackward0>))"
NA0079-PC,NO OKAY I SEE AND WHAT WERE YOU DOING ON YOUR BED,I was going to sleep,"(['fear', 'enjoyment', 'sadness', 'anger'], tensor([0.0144, 0.0626, 0.0475, 0.0750], grad_fn=<DivBackward0>))"
NA0079-PC,OKAY WHAT HAPPENED THEN WHEN YOU WERE GOING TO SLEEP,Then he came in and he said he had a present for me,"(['fear', 'enjoyment', 'sadness', 'anger'], tensor([-0.0104,  0.0279,  0.0343,  0.0555], grad_fn=<DivBackward0>))"
NA0079-PC,OH OKAY HE SAID HE HAS A PRESENT OKAY AND WHAT WAS DAD’S PRESENT,It wasn’t really a present,"(['fear', 'enjoyment', 'sadness', 'anger'], tensor([-0.0051,  0.0516,  0.0380,  0.0661], grad_fn=<DivBackward0>))"
NA0047-PC,OKAY SO IT’S VERY IMPORTANT THAT YOU TELL ME WHAT’S HAPPENED IN THE TUNNEL AND I WANT TO BE IT’S VERY IMPORTANT THAT YOU TELL ME WHAT HAPPENED IN THE TUNNEL ARE YOU ABLE TO TALK WITH ME A BIT MORE ABOUT THAT,Yeah,"(['fear', 'enjoyment', 'sadness', 'anger'], tensor([0.0598, 0.0992, 0.0732, 0.0405], grad_fn=<DivBackward0>))"
NA0047-PC,OKAY WHAT HAPPENED IN THE TUNNEL THEN ISABELLE,He told me that he has to be the doctor and I have to be the patient,"(['fear', 'enjoyment', 'sadness', 'anger'], tensor([0.0363, 0.0782, 0.0416, 0.0223], grad_fn=<DivBackward0>))"
NA0047-PC,OKAY AND THEN WHAT HAPPENS WITH THAT GAME,He got a stick and he knocked it on all my bones,"(['fear', 'enjoyment', 'sadness', 'anger'], tensor([0.0869, 0.1143, 0.0835, 0.0736], grad_fn=<DivBackward0>))"
NA0047-PC,AND HE WHAT SORRY,Knocked it on all my bones,"(['fear', 'enjoyment', 'sadness', 'anger'], tensor([0.0861, 0.1092, 0.0891, 0.0810], grad_fn=<DivBackward0>))"
NA0047-PC,KNOCKED IT ON YOUR BONES,Hm-hm,"(['fear', 'enjoyment', 'sadness', 'anger'], tensor([0.0865, 0.1135, 0.0824, 0.0799], grad_fn=<DivBackward0>))"
NA0076-PC,TELL ME MORE ABOUT THE PART WHERE HE PUT HIS HAND IN YOUR UNDIES,He wrapped his hand around my doodle and then I said I didn’t like it,"(['fear', 'enjoyment', 'sadness', 'anger'], tensor([0.0686, 0.1361, 0.0781, 0.0664], grad_fn=<DivBackward0>))"
NA0076-PC,HM-HM,And then he laughed and took it out,"(['fear', 'enjoyment', 'sadness', 'anger'], tensor([0.0451, 0.1271, 0.0581, 0.0497], grad_fn=<DivBackward0>))"
NA0076-PC,OKAY WHAT HAPPENS NEXT,And then I went home,"(['fear', 'enjoyment', 'sadness', 'anger'], tensor([0.0452, 0.1197, 0.0678, 0.0527], grad_fn=<DivBackward0>))"
NA0076-PC,HM-HM AND WAS ANYONE ELSE WITH YOU AT UNCLE GEORGE,No,"(['fear', 'enjoyment', 'sadness', 'anger'], tensor([0.0558, 0.1098, 0.0515, 0.0544], grad_fn=<DivBackward0>))"
NA0076-PC,HM-HM AND CAN YOU TELL ME MORE ABOUT THE BIG BOYS GAME HAVE YOU PLAYED IT MORE THAN ONE TIME,Yes,"(['fear', 'enjoyment', 'sadness', 'anger'], tensor([0.0644, 0.1070, 0.0603, 0.0561], grad_fn=<DivBackward0>))"
NA0082-PC,DID ANYBODY ELSE SEE THE MARKS,No,"(['fear', 'enjoyment', 'sadness', 'anger'], tensor([0.0368, 0.0566, 0.0787, 0.0707], grad_fn=<DivBackward0>))"
NA0082-PC,NO WHY NOT,I don’t know,"(['fear', 'enjoyment', 'sadness', 'anger'], tensor([0.0581, 0.0924, 0.0754, 0.0431], grad_fn=<DivBackward0>))"
NA0082-PC,OKAY SO TELL ME MORE ABOUT THE PART WHERE YOU BROKE THE CONTROLLER WHAT HAPPENED,We were just playing Nintendo and I was just standing up so I could go faster and it fell,"(['fear', 'enjoyment', 'sadness', 'anger'], tensor([0.0025, 0.0180, 0.0549, 0.0141], grad_fn=<DivBackward0>))"
NA0082-PC,OKAY,And then he said I was in trouble,"(['fear', 'enjoyment', 'sadness', 'anger'], tensor([-0.0003,  0.0114,  0.0476,  0.0188], grad_fn=<DivBackward0>))"
NA0082-PC,OKAY SO NO ONE ELSE WAS HOME WHERE WAS EVERYONE ELSE,Work,"(['fear', 'enjoyment', 'sadness', 'anger'], tensor([0.0048, 0.0163, 0.0492, 0.0253], grad_fn=<DivBackward0>))"
NA0047-PC,OH YEAH AND WHAT DOES THAT MEAN,He tells me to go on my hands and knees,"(['fear', 'enjoyment', 'sadness', 'anger'], tensor([0.1310, 0.1460, 0.0847, 0.1466], grad_fn=<DivBackward0>))"
NA0047-PC,HM-HM,And then he put the stick in my bottom,"(['fear', 'enjoyment', 'sadness', 'anger'], tensor([0.0990, 0.1238, 0.0405, 0.1123], grad_fn=<DivBackward0>))"
NA0047-PC,OH OKAY HAS THIS HAPPENED BEFORE,No,"(['fear', 'enjoyment', 'sadness', 'anger'], tensor([0.0690, 0.0695, 0.0114, 0.0661], grad_fn=<DivBackward0>))"
NA0047-PC,AND THEN WHAT HAPPENED,I started crying,"(['fear', 'enjoyment', 'sadness', 'anger'], tensor([0.0593, 0.0614, 0.0641, 0.0914], grad_fn=<DivBackward0>))"
NA0047-PC,OKAY DID IT HURT,Yeah,"(['fear', 'enjoyment', 'sadness', 'anger'], tensor([0.0216, 0.0378, 0.0322, 0.0556], grad_fn=<DivBackward0>))"
NA0038-M6,HM-HM,And so that’s when I started crying a lot and I couldn’t stop crying,"(['fear', 'enjoyment', 'sadness', 'anger'], tensor([0.1405, 0.1786, 0.1557, 0.1876], grad_fn=<DivBackward0>))"
NA0038-M6,HM-HM AND WHAT HAPPENED NEXT,Then he just told me that we don’t have to play anymore,"(['fear', 'enjoyment', 'sadness', 'anger'], tensor([0.1424, 0.1622, 0.1613, 0.1786], grad_fn=<DivBackward0>))"
NA0038-M6,HM-HM,And so he just pulled his pants back up,"(['fear', 'enjoyment', 'sadness', 'anger'], tensor([0.1346, 0.1498, 0.1534, 0.1695], grad_fn=<DivBackward0>))"
NA0038-M6,HM-HM,And I let go of my dress,"(['fear', 'enjoyment', 'sadness', 'anger'], tensor([0.1303, 0.1529, 0.1418, 0.1558], grad_fn=<DivBackward0>))"
NA0038-M6,HM-HM AND THEN WHAT HAPPENED,Then he just came over and he gave me a hug,"(['fear', 'enjoyment', 'sadness', 'anger'], tensor([0.1156, 0.1388, 0.1437, 0.1502], grad_fn=<DivBackward0>))"
NA0082-PC,LOTS OF TIMES,Yes and then he just stopped,"(['fear', 'enjoyment', 'sadness', 'anger'], tensor([0.0959, 0.0572, 0.1237, 0.0976], grad_fn=<DivBackward0>))"
NA0082-PC,OKAY IS THIS THE ONLY TIME THAT HE’S HIT YOU,Yes,"(['fear', 'enjoyment', 'sadness', 'anger'], tensor([0.0278, 0.0245, 0.0697, 0.0742], grad_fn=<DivBackward0>))"
NA0082-PC,DO YOU REMEMBER HOW LONG HE WAS HITTING YOU FOR,No,"(['fear', 'enjoyment', 'sadness', 'anger'], tensor([0.0130, 0.0197, 0.0670, 0.0707], grad_fn=<DivBackward0>))"
NA0082-PC,NO DO YOU KNOW WHERE HE GOT THE STICK FROM,Yeah he just got it from the garden,"(['fear', 'enjoyment', 'sadness', 'anger'], tensor([0.0302, 0.0334, 0.0808, 0.0819], grad_fn=<DivBackward0>))"
NA0082-PC,OKAY AND WHO IS MARK,He’s my cousin,"(['fear', 'enjoyment', 'sadness', 'anger'], tensor([0.0379, 0.0346, 0.0788, 0.0871], grad_fn=<DivBackward0>))"
NA0078-PC,AND WHAT HAPPENS AFTER THAT,And then I played outside,"(['fear', 'enjoyment', 'sadness', 'anger'], tensor([0.1580, 0.1939, 0.1500, 0.1369], grad_fn=<DivBackward0>))"
NA0078-PC,YOU PLAY OUTSIDE OKAY YOU’VE DONE A GREAT JOB IN TALKING TO ME TODAY YOU’RE DOING REALLY WELL TELLME JUST FROM THE BEGINNING WHEN HE FOLLOWS YOU INTO THE CUPBOARD JUST TELL ME THAT BIT WHEN HE FOLLOWS YOU INTO THE CUPBOARD SO THE BIT WHEN HE GOES FIRST,He pulls his pants down,"(['fear', 'enjoyment', 'sadness', 'anger'], tensor([0.1184, 0.1785, 0.1031, 0.1058], grad_fn=<DivBackward0>))"
NA0078-PC,YEAH WHAT THEN,He showed me his willy,"(['fear', 'enjoyment', 'sadness', 'anger'], tensor([0.1090, 0.1701, 0.0950, 0.1066], grad_fn=<DivBackward0>))"
NA0078-PC,SO HE FOLLOWS YOU INTO THE CUPBOARD AND THEN HE PULLS HIS PANTS DOWN AND SHOWS YOU HIS WILLY IS THAT HAVE I GOT THAT RIGHT,Hm-hm,"(['fear', 'enjoyment', 'sadness', 'anger'], tensor([0.1072, 0.1680, 0.0901, 0.1076], grad_fn=<DivBackward0>))"
NA0078-PC,OKAY AND WHAT THEN,Then I have to pull my dress up,"(['fear', 'enjoyment', 'sadness', 'anger'], tensor([0.1000, 0.1610, 0.0803, 0.1032], grad_fn=<DivBackward0>))"
NA0043-PC,HM-HM WHAT HAPPENED AFTER THAT,And then we went back to play on the playground,"(['fear', 'enjoyment', 'sadness', 'anger'], tensor([0.0929, 0.1164, 0.1017, 0.0582], grad_fn=<DivBackward0>))"
NA0043-PC,HM DID ANYTHING ELSE HAPPEN TO YOU WHILE YOU WERE IN THE TOILET WITH SAM,No,"(['fear', 'enjoyment', 'sadness', 'anger'], tensor([0.0488, 0.0727, 0.0351, 0.0410], grad_fn=<DivBackward0>))"
NA0043-PC,YOU SAID THERE WERE OTHER BOYS THERE,Yes,"(['fear', 'enjoyment', 'sadness', 'anger'], tensor([0.0435, 0.0582, 0.0410, 0.0330], grad_fn=<DivBackward0>))"
NA0043-PC,WHAT HAPPENED WITH THE OTHER BOYS,They were just watching,"(['fear', 'enjoyment', 'sadness', 'anger'], tensor([0.0535, 0.0707, 0.0492, 0.0451], grad_fn=<DivBackward0>))"
NA0043-PC,HM-HM WHAT WERE THEY DOING WHEN THEY WERE WATCHING,They were just laughing,"(['fear', 'enjoyment', 'sadness', 'anger'], tensor([0.0625, 0.1111, 0.0541, 0.0663], grad_fn=<DivBackward0>))"
NA0079-PC,OKAY AND WHAT’S THAT,My undies,"(['fear', 'enjoyment', 'sadness', 'anger'], tensor([0.1585, 0.1963, 0.1264, 0.1698], grad_fn=<DivBackward0>))"
NA0079-PC,OKAY AND WHAT’S YOUR UNDIES LIKE,They’re white,"(['fear', 'enjoyment', 'sadness', 'anger'], tensor([0.1193, 0.1596, 0.0828, 0.1507], grad_fn=<DivBackward0>))"
NA0079-PC,THEY’RE WHITE UNDIES OKAY GOOD GIRL OKAY THAT’S BRILLIANT YOU’VE GIVEN ME LOTS OF INFORMATION THERE SOPHIE OKAY SO WHERE WOULD YOUR CLOTHES BE NOW,He pulled my undies off,"(['fear', 'enjoyment', 'sadness', 'anger'], tensor([0.0823, 0.1181, 0.0545, 0.1176], grad_fn=<DivBackward0>))"
NA0079-PC,OKAY AND WHERE WERE THEY WHERE DID THEY GO,I don’t know,"(['fear', 'enjoyment', 'sadness', 'anger'], tensor([0.0807, 0.1152, 0.0665, 0.1156], grad_fn=<DivBackward0>))"
NA0079-PC,OKAY THAT’S FINE AND WHEN YOU TALK TO MUMMY DID YOU TELL MUMMY THAT YOUR UNDIES WERE OFF,No,"(['fear', 'enjoyment', 'sadness', 'anger'], tensor([0.0838, 0.1230, 0.0541, 0.1119], grad_fn=<DivBackward0>))"
NA0054-PC,HM-HM,And I really needed to go to the toilet,"(['fear', 'enjoyment', 'sadness', 'anger'], tensor([0.0637, 0.1040, 0.0710, 0.0870], grad_fn=<DivBackward0>))"
NA0054-PC,OKAY AND THEN WHAT HAPPENED NEXT,I went to the toilet by myself because Mum couldn’t leave my baby brother by himself,"(['fear', 'enjoyment', 'sadness', 'anger'], tensor([0.1192, 0.1263, 0.1007, 0.0993], grad_fn=<DivBackward0>))"
NA0054-PC,AH-HA,And then I went to the toilet by myself,"(['fear', 'enjoyment', 'sadness', 'anger'], tensor([0.0956, 0.1129, 0.0727, 0.0793], grad_fn=<DivBackward0>))"
NA0054-PC,OKAY AND TELL ME EVERYTHING THAT HAPPENED FROM WHEN YOU WENT TO THE TOILET,I went into the toilet and I didn’t lock the door because I didn’t want to get stuck in,"(['fear', 'enjoyment', 'sadness', 'anger'], tensor([0.1455, 0.1558, 0.1036, 0.1267], grad_fn=<DivBackward0>))"
NA0054-PC,HM-HM,And then the bad man came inside,"(['fear', 'enjoyment', 'sadness', 'anger'], tensor([0.1350, 0.1455, 0.1074, 0.1239], grad_fn=<DivBackward0>))"
NA0038-M6,HM-HM,So that’s what I was doing and he was helping me,"(['fear', 'enjoyment', 'sadness', 'anger'], tensor([0.0718, 0.1276, 0.1193, 0.1326], grad_fn=<DivBackward0>))"
NA0038-M6,HM-HM AND CAN YOU TELL ME MORE ABOUT WHAT HAPPENED IN THE CUPBOARD BECAUSE REMEMBER I WASN’T THERE SO I DON’T KNOW WHAT HAPPENED,He said that the game was called show and tell,"(['fear', 'enjoyment', 'sadness', 'anger'], tensor([0.1113, 0.1297, 0.1207, 0.1307], grad_fn=<DivBackward0>))"
NA0038-M6,HM-HM,But when I play normal show and tell it’s not with your privates,"(['fear', 'enjoyment', 'sadness', 'anger'], tensor([0.0670, 0.1115, 0.0739, 0.0814], grad_fn=<DivBackward0>))"
NA0038-M6,HM-HM AND SO WHAT HAPPENED WHEN THERE WAS A SURPRISE,It was just when he showed me his gross willy,"(['fear', 'enjoyment', 'sadness', 'anger'], tensor([0.0671, 0.0985, 0.0610, 0.0753], grad_fn=<DivBackward0>))"
NA0038-M6,HM-HM,And it made me really scared,"(['fear', 'enjoyment', 'sadness', 'anger'], tensor([0.0963, 0.1046, 0.0611, 0.0733], grad_fn=<DivBackward0>))"
